{
  "$schema": "../../docs/插件开发/plugin.schema.json",
  "type": "view",
  "name": "设置",
  "version": "1.0.0",
  "icon": "settings-gear",
  "iconSource": "codicon",
  "description": "软件设置——主题、语言、插件管理",
  "author": "官方",
  "core": true,
  "entry": "index.tsx",
  "tabBehavior": {
    "singleton": true
  }
}
